id,name,model_id:id,group_id:id,perm_read,perm_write,perm_create,perm_unlink
quiz_engine_quiz_user,Quiz Engine quiz user,model_quiz_quiz,base.group_user,1,1,1,1
quiz_engine_question_user,Quiz Engine question user,model_quiz_question,base.group_user,1,1,1,1
quiz_engine_session_user,Quiz Engine session user,model_quiz_session,base.group_user,1,1,1,1
quiz_engine_quiz_public,Quiz Engine quiz public,model_quiz_quiz,base.group_public,1,0,0,0
quiz_engine_question_public,Quiz Engine question public,model_quiz_question,base.group_public,1,0,0,0
quiz_engine_session_public,Quiz Engine session public,model_quiz_session,base.group_public,1,1,1,0
